{
  "id": "zombie.runner",
  "extends": "zombie.base",
  "name": "Runner",
  "introducedInWave": 3,
  "weight": 6,
  "appearance": { "sprite": "body_shambler", "hitFx": "fx_blood_hit" },
  "sensory": { "noise": 0.9, "light": 0.9, "scent": 0.4 },
  "locomotion": { "speed": 1.4, "wander": 0.3, "mill": 0.3, "crawl": 0.25 },
  "body": { "head": 20, "torso": 45, "legs": 35 },
  "variance": { "tints": ["#f0d8d2", "#e8cdc6", "#f2e0d8", "#dec4bc"] }
}
