{
  "id": "zombie.shambler",
  "extends": "zombie.base",
  "name": "Shambler",
  "introducedInWave": 0,
  "weight": 80,
  "appearance": { "sprite": "body_shambler", "hitFx": "fx_blood_hit" },
  "body": { "head": 25, "torso": 60, "legs": 40 },
  "sensory": { "noise": 0.2, "light": 0.1, "scent": 0.9 },
  "locomotion": { "speed": 0.8, "wander": 0.35, "mill": 0.25, "crawl": 0.25 }
}
