{
  "id": "zombie.heavy",
  "extends": "zombie.base",
  "name": "Heavy",
  "introducedInWave": 2,
  "weight": 4,
  "appearance": { "sprite": "body_shambler", "hitFx": "fx_blood_hit" },
  "sensory": { "noise": 0.9, "light": 0.1, "scent": 0.2 },
  "locomotion": { "speed": 0.6, "wander": 0.25, "mill": 0.2, "crawl": 0.2 },
  "body": { "head": 40, "torso": 120, "legs": 80 },
  "variance": { "tints": ["#e6dccb", "#dcd2c0", "#efe5d4", "#d2cab8"] }
}
